<?xml version="1.0" encoding="utf-8"?>
<config xmlns:xsi="http://www.w3.org/2001/XMLSchema-instance"
        xsi:noNamespaceSchemaLocation="http://corchestra.ru/schema/fluteconfig.xsd">
    <dbconnstring>jdbc:postgresql://127.0.0.1:5432/celesta</dbconnstring>
    <dbuser>postgres</dbuser>
    <dbpassword>123</dbpassword>
    <redishost>localhost</redishost>
    <redisport>6379</redisport>
    <neverstop>false</neverstop>
    <retrywait>50000</retrywait>
    <scorepath>D:/score</scorepath>
    <resthost>127.0.0.1</resthost>
    <restport>12345</restport>
    <resttimeout>360</resttimeout>
    <pylibpath>D:/jython2.7.0/Lib</pylibpath>
    <looptask>
        <script>foo.hello.run</script>
        <waitonsuccess>1000</waitonsuccess>
        <waitonfailure>30000</waitonfailure>
        <count>1</count>
        <finalizer>ru.curs.flute.Hello#stop</finalizer>
    </looptask>
</config>